
*** Running vivado
    with args -log ChipInterface.vdi -applog -m64 -product Vivado -messageDb vivado.pb -mode batch -source ChipInterface.tcl -notrace


****** Vivado v2024.2 (64-bit)
  **** SW Build 5239630 on Fri Nov 08 22:34:34 MST 2024
  **** IP Build 5239520 on Sun Nov 10 16:12:51 MST 2024
  **** SharedData Build 5239561 on Fri Nov 08 14:39:27 MST 2024
  **** Start of session at: Tue Feb  3 15:46:26 2026
    ** Copyright 1986-2022 Xilinx, Inc. All Rights Reserved.
    ** Copyright 2022-2024 Advanced Micro Devices, Inc. All Rights Reserved.

source ChipInterface.tcl -notrace
Command: link_design -top ChipInterface -part xc7s50csga324-1
Design is defaulting to srcset: sources_1
Design is defaulting to constrset: constrs_1
INFO: [Device 21-403] Loading part xc7s50csga324-1
Netlist sorting complete. Time (s): cpu = 00:00:00 ; elapsed = 00:00:00 . Memory (MB): peak = 1714.453 ; gain = 0.000 ; free physical = 14532 ; free virtual = 37638
INFO: [Project 1-479] Netlist was created with Vivado 2024.2
INFO: [Project 1-570] Preparing netlist for logic optimization
Parsing XDC File [/afs/andrew.cmu.edu/usr21/eqian/Downloads/Boolean240.xdc]
WARNING: [Vivado 12-584] No ports matched 'CLOCK_100'. [/afs/andrew.cmu.edu/usr21/eqian/Downloads/Boolean240.xdc:3]
CRITICAL WARNING: [Common 17-55] 'set_property' expects at least one object. [/afs/andrew.cmu.edu/usr21/eqian/Downloads/Boolean240.xdc:3]
Resolution: If [get_<value>] was used to populate the object, check to make sure this command returns at least one valid object.
WARNING: [Vivado 12-507] No nets matched 'BTN_IBUF[3]'. [/afs/andrew.cmu.edu/usr21/eqian/Downloads/Boolean240.xdc:6]
CRITICAL WARNING: [Common 17-55] 'set_property' expects at least one object. [/afs/andrew.cmu.edu/usr21/eqian/Downloads/Boolean240.xdc:6]
Resolution: If [get_<value>] was used to populate the object, check to make sure this command returns at least one valid object.
WARNING: [Vivado 12-584] No ports matched 'BTN[0]'. [/afs/andrew.cmu.edu/usr21/eqian/Downloads/Boolean240.xdc:49]
CRITICAL WARNING: [Common 17-55] 'set_property' expects at least one object. [/afs/andrew.cmu.edu/usr21/eqian/Downloads/Boolean240.xdc:49]
Resolution: If [get_<value>] was used to populate the object, check to make sure this command returns at least one valid object.
WARNING: [Vivado 12-584] No ports matched 'BTN[1]'. [/afs/andrew.cmu.edu/usr21/eqian/Downloads/Boolean240.xdc:50]
CRITICAL WARNING: [Common 17-55] 'set_property' expects at least one object. [/afs/andrew.cmu.edu/usr21/eqian/Downloads/Boolean240.xdc:50]
Resolution: If [get_<value>] was used to populate the object, check to make sure this command returns at least one valid object.
WARNING: [Vivado 12-584] No ports matched 'BTN[2]'. [/afs/andrew.cmu.edu/usr21/eqian/Downloads/Boolean240.xdc:51]
CRITICAL WARNING: [Common 17-55] 'set_property' expects at least one object. [/afs/andrew.cmu.edu/usr21/eqian/Downloads/Boolean240.xdc:51]
Resolution: If [get_<value>] was used to populate the object, check to make sure this command returns at least one valid object.
WARNING: [Vivado 12-584] No ports matched 'BTN[3]'. [/afs/andrew.cmu.edu/usr21/eqian/Downloads/Boolean240.xdc:52]
CRITICAL WARNING: [Common 17-55] 'set_property' expects at least one object. [/afs/andrew.cmu.edu/usr21/eqian/Downloads/Boolean240.xdc:52]
Resolution: If [get_<value>] was used to populate the object, check to make sure this command returns at least one valid object.
WARNING: [Vivado 12-584] No ports matched 'RGB0[0]'. [/afs/andrew.cmu.edu/usr21/eqian/Downloads/Boolean240.xdc:55]
CRITICAL WARNING: [Common 17-55] 'set_property' expects at least one object. [/afs/andrew.cmu.edu/usr21/eqian/Downloads/Boolean240.xdc:55]
Resolution: If [get_<value>] was used to populate the object, check to make sure this command returns at least one valid object.
WARNING: [Vivado 12-584] No ports matched 'RGB0[1]'. [/afs/andrew.cmu.edu/usr21/eqian/Downloads/Boolean240.xdc:56]
CRITICAL WARNING: [Common 17-55] 'set_property' expects at least one object. [/afs/andrew.cmu.edu/usr21/eqian/Downloads/Boolean240.xdc:56]
Resolution: If [get_<value>] was used to populate the object, check to make sure this command returns at least one valid object.
WARNING: [Vivado 12-584] No ports matched 'RGB0[2]'. [/afs/andrew.cmu.edu/usr21/eqian/Downloads/Boolean240.xdc:57]
CRITICAL WARNING: [Common 17-55] 'set_property' expects at least one object. [/afs/andrew.cmu.edu/usr21/eqian/Downloads/Boolean240.xdc:57]
Resolution: If [get_<value>] was used to populate the object, check to make sure this command returns at least one valid object.
WARNING: [Vivado 12-584] No ports matched 'RGB1[0]'. [/afs/andrew.cmu.edu/usr21/eqian/Downloads/Boolean240.xdc:58]
CRITICAL WARNING: [Common 17-55] 'set_property' expects at least one object. [/afs/andrew.cmu.edu/usr21/eqian/Downloads/Boolean240.xdc:58]
Resolution: If [get_<value>] was used to populate the object, check to make sure this command returns at least one valid object.
WARNING: [Vivado 12-584] No ports matched 'RGB1[1]'. [/afs/andrew.cmu.edu/usr21/eqian/Downloads/Boolean240.xdc:59]
CRITICAL WARNING: [Common 17-55] 'set_property' expects at least one object. [/afs/andrew.cmu.edu/usr21/eqian/Downloads/Boolean240.xdc:59]
Resolution: If [get_<value>] was used to populate the object, check to make sure this command returns at least one valid object.
WARNING: [Vivado 12-584] No ports matched 'RGB1[2]'. [/afs/andrew.cmu.edu/usr21/eqian/Downloads/Boolean240.xdc:60]
CRITICAL WARNING: [Common 17-55] 'set_property' expects at least one object. [/afs/andrew.cmu.edu/usr21/eqian/Downloads/Boolean240.xdc:60]
Resolution: If [get_<value>] was used to populate the object, check to make sure this command returns at least one valid object.
WARNING: [Vivado 12-584] No ports matched 'D1_AN[0]'. [/afs/andrew.cmu.edu/usr21/eqian/Downloads/Boolean240.xdc:63]
CRITICAL WARNING: [Common 17-55] 'set_property' expects at least one object. [/afs/andrew.cmu.edu/usr21/eqian/Downloads/Boolean240.xdc:63]
Resolution: If [get_<value>] was used to populate the object, check to make sure this command returns at least one valid object.
WARNING: [Vivado 12-584] No ports matched 'D1_AN[1]'. [/afs/andrew.cmu.edu/usr21/eqian/Downloads/Boolean240.xdc:64]
CRITICAL WARNING: [Common 17-55] 'set_property' expects at least one object. [/afs/andrew.cmu.edu/usr21/eqian/Downloads/Boolean240.xdc:64]
Resolution: If [get_<value>] was used to populate the object, check to make sure this command returns at least one valid object.
WARNING: [Vivado 12-584] No ports matched 'D1_AN[2]'. [/afs/andrew.cmu.edu/usr21/eqian/Downloads/Boolean240.xdc:65]
CRITICAL WARNING: [Common 17-55] 'set_property' expects at least one object. [/afs/andrew.cmu.edu/usr21/eqian/Downloads/Boolean240.xdc:65]
Resolution: If [get_<value>] was used to populate the object, check to make sure this command returns at least one valid object.
WARNING: [Vivado 12-584] No ports matched 'D1_AN[3]'. [/afs/andrew.cmu.edu/usr21/eqian/Downloads/Boolean240.xdc:66]
CRITICAL WARNING: [Common 17-55] 'set_property' expects at least one object. [/afs/andrew.cmu.edu/usr21/eqian/Downloads/Boolean240.xdc:66]
Resolution: If [get_<value>] was used to populate the object, check to make sure this command returns at least one valid object.
WARNING: [Vivado 12-584] No ports matched 'D1_SEG[0]'. [/afs/andrew.cmu.edu/usr21/eqian/Downloads/Boolean240.xdc:67]
CRITICAL WARNING: [Common 17-55] 'set_property' expects at least one object. [/afs/andrew.cmu.edu/usr21/eqian/Downloads/Boolean240.xdc:67]
Resolution: If [get_<value>] was used to populate the object, check to make sure this command returns at least one valid object.
WARNING: [Vivado 12-584] No ports matched 'D1_SEG[1]'. [/afs/andrew.cmu.edu/usr21/eqian/Downloads/Boolean240.xdc:68]
CRITICAL WARNING: [Common 17-55] 'set_property' expects at least one object. [/afs/andrew.cmu.edu/usr21/eqian/Downloads/Boolean240.xdc:68]
Resolution: If [get_<value>] was used to populate the object, check to make sure this command returns at least one valid object.
WARNING: [Vivado 12-584] No ports matched 'D1_SEG[2]'. [/afs/andrew.cmu.edu/usr21/eqian/Downloads/Boolean240.xdc:69]
CRITICAL WARNING: [Common 17-55] 'set_property' expects at least one object. [/afs/andrew.cmu.edu/usr21/eqian/Downloads/Boolean240.xdc:69]
Resolution: If [get_<value>] was used to populate the object, check to make sure this command returns at least one valid object.
WARNING: [Vivado 12-584] No ports matched 'D1_SEG[3]'. [/afs/andrew.cmu.edu/usr21/eqian/Downloads/Boolean240.xdc:70]
CRITICAL WARNING: [Common 17-55] 'set_property' expects at least one object. [/afs/andrew.cmu.edu/usr21/eqian/Downloads/Boolean240.xdc:70]
Resolution: If [get_<value>] was used to populate the object, check to make sure this command returns at least one valid object.
WARNING: [Vivado 12-584] No ports matched 'D1_SEG[4]'. [/afs/andrew.cmu.edu/usr21/eqian/Downloads/Boolean240.xdc:71]
CRITICAL WARNING: [Common 17-55] 'set_property' expects at least one object. [/afs/andrew.cmu.edu/usr21/eqian/Downloads/Boolean240.xdc:71]
Resolution: If [get_<value>] was used to populate the object, check to make sure this command returns at least one valid object.
WARNING: [Vivado 12-584] No ports matched 'D1_SEG[5]'. [/afs/andrew.cmu.edu/usr21/eqian/Downloads/Boolean240.xdc:72]
CRITICAL WARNING: [Common 17-55] 'set_property' expects at least one object. [/afs/andrew.cmu.edu/usr21/eqian/Downloads/Boolean240.xdc:72]
Resolution: If [get_<value>] was used to populate the object, check to make sure this command returns at least one valid object.
WARNING: [Vivado 12-584] No ports matched 'D1_SEG[6]'. [/afs/andrew.cmu.edu/usr21/eqian/Downloads/Boolean240.xdc:73]
CRITICAL WARNING: [Common 17-55] 'set_property' expects at least one object. [/afs/andrew.cmu.edu/usr21/eqian/Downloads/Boolean240.xdc:73]
Resolution: If [get_<value>] was used to populate the object, check to make sure this command returns at least one valid object.
WARNING: [Vivado 12-584] No ports matched 'D1_SEG[7]'. [/afs/andrew.cmu.edu/usr21/eqian/Downloads/Boolean240.xdc:74]
CRITICAL WARNING: [Common 17-55] 'set_property' expects at least one object. [/afs/andrew.cmu.edu/usr21/eqian/Downloads/Boolean240.xdc:74]
Resolution: If [get_<value>] was used to populate the object, check to make sure this command returns at least one valid object.
WARNING: [Vivado 12-584] No ports matched 'D2_AN[0]'. [/afs/andrew.cmu.edu/usr21/eqian/Downloads/Boolean240.xdc:77]
CRITICAL WARNING: [Common 17-55] 'set_property' expects at least one object. [/afs/andrew.cmu.edu/usr21/eqian/Downloads/Boolean240.xdc:77]
Resolution: If [get_<value>] was used to populate the object, check to make sure this command returns at least one valid object.
WARNING: [Vivado 12-584] No ports matched 'D2_AN[1]'. [/afs/andrew.cmu.edu/usr21/eqian/Downloads/Boolean240.xdc:78]
CRITICAL WARNING: [Common 17-55] 'set_property' expects at least one object. [/afs/andrew.cmu.edu/usr21/eqian/Downloads/Boolean240.xdc:78]
Resolution: If [get_<value>] was used to populate the object, check to make sure this command returns at least one valid object.
WARNING: [Vivado 12-584] No ports matched 'D2_AN[2]'. [/afs/andrew.cmu.edu/usr21/eqian/Downloads/Boolean240.xdc:79]
CRITICAL WARNING: [Common 17-55] 'set_property' expects at least one object. [/afs/andrew.cmu.edu/usr21/eqian/Downloads/Boolean240.xdc:79]
Resolution: If [get_<value>] was used to populate the object, check to make sure this command returns at least one valid object.
WARNING: [Vivado 12-584] No ports matched 'D2_AN[3]'. [/afs/andrew.cmu.edu/usr21/eqian/Downloads/Boolean240.xdc:80]
CRITICAL WARNING: [Common 17-55] 'set_property' expects at least one object. [/afs/andrew.cmu.edu/usr21/eqian/Downloads/Boolean240.xdc:80]
Resolution: If [get_<value>] was used to populate the object, check to make sure this command returns at least one valid object.
WARNING: [Vivado 12-584] No ports matched 'D2_SEG[0]'. [/afs/andrew.cmu.edu/usr21/eqian/Downloads/Boolean240.xdc:81]
CRITICAL WARNING: [Common 17-55] 'set_property' expects at least one object. [/afs/andrew.cmu.edu/usr21/eqian/Downloads/Boolean240.xdc:81]
Resolution: If [get_<value>] was used to populate the object, check to make sure this command returns at least one valid object.
WARNING: [Vivado 12-584] No ports matched 'D2_SEG[1]'. [/afs/andrew.cmu.edu/usr21/eqian/Downloads/Boolean240.xdc:82]
CRITICAL WARNING: [Common 17-55] 'set_property' expects at least one object. [/afs/andrew.cmu.edu/usr21/eqian/Downloads/Boolean240.xdc:82]
Resolution: If [get_<value>] was used to populate the object, check to make sure this command returns at least one valid object.
WARNING: [Vivado 12-584] No ports matched 'D2_SEG[2]'. [/afs/andrew.cmu.edu/usr21/eqian/Downloads/Boolean240.xdc:83]
CRITICAL WARNING: [Common 17-55] 'set_property' expects at least one object. [/afs/andrew.cmu.edu/usr21/eqian/Downloads/Boolean240.xdc:83]
Resolution: If [get_<value>] was used to populate the object, check to make sure this command returns at least one valid object.
WARNING: [Vivado 12-584] No ports matched 'D2_SEG[3]'. [/afs/andrew.cmu.edu/usr21/eqian/Downloads/Boolean240.xdc:84]
CRITICAL WARNING: [Common 17-55] 'set_property' expects at least one object. [/afs/andrew.cmu.edu/usr21/eqian/Downloads/Boolean240.xdc:84]
Resolution: If [get_<value>] was used to populate the object, check to make sure this command returns at least one valid object.
WARNING: [Vivado 12-584] No ports matched 'D2_SEG[4]'. [/afs/andrew.cmu.edu/usr21/eqian/Downloads/Boolean240.xdc:85]
CRITICAL WARNING: [Common 17-55] 'set_property' expects at least one object. [/afs/andrew.cmu.edu/usr21/eqian/Downloads/Boolean240.xdc:85]
Resolution: If [get_<value>] was used to populate the object, check to make sure this command returns at least one valid object.
WARNING: [Vivado 12-584] No ports matched 'D2_SEG[5]'. [/afs/andrew.cmu.edu/usr21/eqian/Downloads/Boolean240.xdc:86]
CRITICAL WARNING: [Common 17-55] 'set_property' expects at least one object. [/afs/andrew.cmu.edu/usr21/eqian/Downloads/Boolean240.xdc:86]
Resolution: If [get_<value>] was used to populate the object, check to make sure this command returns at least one valid object.
WARNING: [Vivado 12-584] No ports matched 'D2_SEG[6]'. [/afs/andrew.cmu.edu/usr21/eqian/Downloads/Boolean240.xdc:87]
CRITICAL WARNING: [Common 17-55] 'set_property' expects at least one object. [/afs/andrew.cmu.edu/usr21/eqian/Downloads/Boolean240.xdc:87]
Resolution: If [get_<value>] was used to populate the object, check to make sure this command returns at least one valid object.
WARNING: [Vivado 12-584] No ports matched 'D2_SEG[7]'. [/afs/andrew.cmu.edu/usr21/eqian/Downloads/Boolean240.xdc:88]
CRITICAL WARNING: [Common 17-55] 'set_property' expects at least one object. [/afs/andrew.cmu.edu/usr21/eqian/Downloads/Boolean240.xdc:88]
Resolution: If [get_<value>] was used to populate the object, check to make sure this command returns at least one valid object.
WARNING: [Vivado 12-584] No ports matched 'UART_rxd'. [/afs/andrew.cmu.edu/usr21/eqian/Downloads/Boolean240.xdc:91]
CRITICAL WARNING: [Common 17-55] 'set_property' expects at least one object. [/afs/andrew.cmu.edu/usr21/eqian/Downloads/Boolean240.xdc:91]
Resolution: If [get_<value>] was used to populate the object, check to make sure this command returns at least one valid object.
WARNING: [Vivado 12-584] No ports matched 'UART_txd'. [/afs/andrew.cmu.edu/usr21/eqian/Downloads/Boolean240.xdc:92]
CRITICAL WARNING: [Common 17-55] 'set_property' expects at least one object. [/afs/andrew.cmu.edu/usr21/eqian/Downloads/Boolean240.xdc:92]
Resolution: If [get_<value>] was used to populate the object, check to make sure this command returns at least one valid object.
WARNING: [Vivado 12-584] No ports matched 'hdmi_clk_n'. [/afs/andrew.cmu.edu/usr21/eqian/Downloads/Boolean240.xdc:95]
CRITICAL WARNING: [Common 17-55] 'set_property' expects at least one object. [/afs/andrew.cmu.edu/usr21/eqian/Downloads/Boolean240.xdc:95]
Resolution: If [get_<value>] was used to populate the object, check to make sure this command returns at least one valid object.
WARNING: [Vivado 12-584] No ports matched 'hdmi_clk_p'. [/afs/andrew.cmu.edu/usr21/eqian/Downloads/Boolean240.xdc:96]
CRITICAL WARNING: [Common 17-55] 'set_property' expects at least one object. [/afs/andrew.cmu.edu/usr21/eqian/Downloads/Boolean240.xdc:96]
Resolution: If [get_<value>] was used to populate the object, check to make sure this command returns at least one valid object.
WARNING: [Vivado 12-584] No ports matched 'hdmi_tx_n[0]'. [/afs/andrew.cmu.edu/usr21/eqian/Downloads/Boolean240.xdc:98]
CRITICAL WARNING: [Common 17-55] 'set_property' expects at least one object. [/afs/andrew.cmu.edu/usr21/eqian/Downloads/Boolean240.xdc:98]
Resolution: If [get_<value>] was used to populate the object, check to make sure this command returns at least one valid object.
WARNING: [Vivado 12-584] No ports matched 'hdmi_tx_n[1]'. [/afs/andrew.cmu.edu/usr21/eqian/Downloads/Boolean240.xdc:99]
CRITICAL WARNING: [Common 17-55] 'set_property' expects at least one object. [/afs/andrew.cmu.edu/usr21/eqian/Downloads/Boolean240.xdc:99]
Resolution: If [get_<value>] was used to populate the object, check to make sure this command returns at least one valid object.
WARNING: [Vivado 12-584] No ports matched 'hdmi_tx_n[2]'. [/afs/andrew.cmu.edu/usr21/eqian/Downloads/Boolean240.xdc:100]
CRITICAL WARNING: [Common 17-55] 'set_property' expects at least one object. [/afs/andrew.cmu.edu/usr21/eqian/Downloads/Boolean240.xdc:100]
Resolution: If [get_<value>] was used to populate the object, check to make sure this command returns at least one valid object.
WARNING: [Vivado 12-584] No ports matched 'hdmi_tx_p[0]'. [/afs/andrew.cmu.edu/usr21/eqian/Downloads/Boolean240.xdc:102]
CRITICAL WARNING: [Common 17-55] 'set_property' expects at least one object. [/afs/andrew.cmu.edu/usr21/eqian/Downloads/Boolean240.xdc:102]
Resolution: If [get_<value>] was used to populate the object, check to make sure this command returns at least one valid object.
WARNING: [Vivado 12-584] No ports matched 'hdmi_tx_p[1]'. [/afs/andrew.cmu.edu/usr21/eqian/Downloads/Boolean240.xdc:103]
CRITICAL WARNING: [Common 17-55] 'set_property' expects at least one object. [/afs/andrew.cmu.edu/usr21/eqian/Downloads/Boolean240.xdc:103]
Resolution: If [get_<value>] was used to populate the object, check to make sure this command returns at least one valid object.
WARNING: [Vivado 12-584] No ports matched 'hdmi_tx_p[2]'. [/afs/andrew.cmu.edu/usr21/eqian/Downloads/Boolean240.xdc:104]
CRITICAL WARNING: [Common 17-55] 'set_property' expects at least one object. [/afs/andrew.cmu.edu/usr21/eqian/Downloads/Boolean240.xdc:104]
Resolution: If [get_<value>] was used to populate the object, check to make sure this command returns at least one valid object.
WARNING: [Vivado 12-584] No ports matched 'left_audio_out'. [/afs/andrew.cmu.edu/usr21/eqian/Downloads/Boolean240.xdc:107]
CRITICAL WARNING: [Common 17-55] 'set_property' expects at least one object. [/afs/andrew.cmu.edu/usr21/eqian/Downloads/Boolean240.xdc:107]
Resolution: If [get_<value>] was used to populate the object, check to make sure this command returns at least one valid object.
WARNING: [Vivado 12-584] No ports matched 'right_audio_out'. [/afs/andrew.cmu.edu/usr21/eqian/Downloads/Boolean240.xdc:108]
CRITICAL WARNING: [Common 17-55] 'set_property' expects at least one object. [/afs/andrew.cmu.edu/usr21/eqian/Downloads/Boolean240.xdc:108]
Resolution: If [get_<value>] was used to populate the object, check to make sure this command returns at least one valid object.
WARNING: [Vivado 12-584] No ports matched 'ble_uart_tx'. [/afs/andrew.cmu.edu/usr21/eqian/Downloads/Boolean240.xdc:111]
CRITICAL WARNING: [Common 17-55] 'set_property' expects at least one object. [/afs/andrew.cmu.edu/usr21/eqian/Downloads/Boolean240.xdc:111]
Resolution: If [get_<value>] was used to populate the object, check to make sure this command returns at least one valid object.
WARNING: [Vivado 12-584] No ports matched 'ble_uart_rx'. [/afs/andrew.cmu.edu/usr21/eqian/Downloads/Boolean240.xdc:112]
CRITICAL WARNING: [Common 17-55] 'set_property' expects at least one object. [/afs/andrew.cmu.edu/usr21/eqian/Downloads/Boolean240.xdc:112]
Resolution: If [get_<value>] was used to populate the object, check to make sure this command returns at least one valid object.
WARNING: [Vivado 12-584] No ports matched 'ble_uart_rts'. [/afs/andrew.cmu.edu/usr21/eqian/Downloads/Boolean240.xdc:113]
CRITICAL WARNING: [Common 17-55] 'set_property' expects at least one object. [/afs/andrew.cmu.edu/usr21/eqian/Downloads/Boolean240.xdc:113]
Resolution: If [get_<value>] was used to populate the object, check to make sure this command returns at least one valid object.
WARNING: [Vivado 12-584] No ports matched 'ble_uart_cts'. [/afs/andrew.cmu.edu/usr21/eqian/Downloads/Boolean240.xdc:114]
CRITICAL WARNING: [Common 17-55] 'set_property' expects at least one object. [/afs/andrew.cmu.edu/usr21/eqian/Downloads/Boolean240.xdc:114]
Resolution: If [get_<value>] was used to populate the object, check to make sure this command returns at least one valid object.
WARNING: [Vivado 12-584] No ports matched 'servo0'. [/afs/andrew.cmu.edu/usr21/eqian/Downloads/Boolean240.xdc:117]
CRITICAL WARNING: [Common 17-55] 'set_property' expects at least one object. [/afs/andrew.cmu.edu/usr21/eqian/Downloads/Boolean240.xdc:117]
Resolution: If [get_<value>] was used to populate the object, check to make sure this command returns at least one valid object.
WARNING: [Vivado 12-584] No ports matched 'servo1'. [/afs/andrew.cmu.edu/usr21/eqian/Downloads/Boolean240.xdc:118]
CRITICAL WARNING: [Common 17-55] 'set_property' expects at least one object. [/afs/andrew.cmu.edu/usr21/eqian/Downloads/Boolean240.xdc:118]
Resolution: If [get_<value>] was used to populate the object, check to make sure this command returns at least one valid object.
WARNING: [Vivado 12-584] No ports matched 'servo2'. [/afs/andrew.cmu.edu/usr21/eqian/Downloads/Boolean240.xdc:119]
CRITICAL WARNING: [Common 17-55] 'set_property' expects at least one object. [/afs/andrew.cmu.edu/usr21/eqian/Downloads/Boolean240.xdc:119]
Resolution: If [get_<value>] was used to populate the object, check to make sure this command returns at least one valid object.
WARNING: [Vivado 12-584] No ports matched 'servo3'. [/afs/andrew.cmu.edu/usr21/eqian/Downloads/Boolean240.xdc:120]
CRITICAL WARNING: [Common 17-55] 'set_property' expects at least one object. [/afs/andrew.cmu.edu/usr21/eqian/Downloads/Boolean240.xdc:120]
Resolution: If [get_<value>] was used to populate the object, check to make sure this command returns at least one valid object.
Finished Parsing XDC File [/afs/andrew.cmu.edu/usr21/eqian/Downloads/Boolean240.xdc]
INFO: [Opt 31-138] Pushed 0 inverter(s) to 0 load pin(s).
Netlist sorting complete. Time (s): cpu = 00:00:00 ; elapsed = 00:00:00 . Memory (MB): peak = 1865.109 ; gain = 0.000 ; free physical = 14442 ; free virtual = 37548
INFO: [Project 1-111] Unisim Transformation Summary:
No Unisim elements were transformed.

5 Infos, 56 Warnings, 56 Critical Warnings and 0 Errors encountered.
link_design completed successfully
Command: opt_design
Attempting to get a license for feature 'Implementation' and/or device 'xc7s50'
INFO: [Common 17-349] Got license for feature 'Implementation' and/or device 'xc7s50'
Running DRC as a precondition to command opt_design

Starting DRC Task
INFO: [DRC 23-27] Running DRC with 8 threads
INFO: [Project 1-461] DRC finished with 0 Errors
INFO: [Project 1-462] Please refer to the DRC report (report_drc) for more information.

Time (s): cpu = 00:00:03 ; elapsed = 00:00:01 . Memory (MB): peak = 1993.875 ; gain = 122.828 ; free physical = 14308 ; free virtual = 37414

Starting Cache Timing Information Task
INFO: [Timing 38-35] Done setting XDC timing constraints.
Ending Cache Timing Information Task | Checksum: 1f810878d

Time (s): cpu = 00:00:03 ; elapsed = 00:00:03 . Memory (MB): peak = 2301.773 ; gain = 307.898 ; free physical = 14033 ; free virtual = 37155

Starting Logic Optimization Task

Phase 1 Initialization

Phase 1.1 Core Generation And Design Setup
Phase 1.1 Core Generation And Design Setup | Checksum: 1f810878d

Time (s): cpu = 00:00:00 ; elapsed = 00:00:00.01 . Memory (MB): peak = 2647.609 ; gain = 0.000 ; free physical = 13693 ; free virtual = 36815

Phase 1.2 Setup Constraints And Sort Netlist
Phase 1.2 Setup Constraints And Sort Netlist | Checksum: 1f810878d

Time (s): cpu = 00:00:00 ; elapsed = 00:00:00.01 . Memory (MB): peak = 2647.609 ; gain = 0.000 ; free physical = 13693 ; free virtual = 36815
Phase 1 Initialization | Checksum: 1f810878d

Time (s): cpu = 00:00:00 ; elapsed = 00:00:00.01 . Memory (MB): peak = 2647.609 ; gain = 0.000 ; free physical = 13693 ; free virtual = 36815

Phase 2 Timer Update And Timing Data Collection

Phase 2.1 Timer Update
Phase 2.1 Timer Update | Checksum: 1f810878d

Time (s): cpu = 00:00:00 ; elapsed = 00:00:00.01 . Memory (MB): peak = 2647.609 ; gain = 0.000 ; free physical = 13693 ; free virtual = 36815

Phase 2.2 Timing Data Collection
Phase 2.2 Timing Data Collection | Checksum: 1f810878d

Time (s): cpu = 00:00:00 ; elapsed = 00:00:00.01 . Memory (MB): peak = 2647.609 ; gain = 0.000 ; free physical = 13693 ; free virtual = 36815
Phase 2 Timer Update And Timing Data Collection | Checksum: 1f810878d

Time (s): cpu = 00:00:00 ; elapsed = 00:00:00.01 . Memory (MB): peak = 2647.609 ; gain = 0.000 ; free physical = 13693 ; free virtual = 36815

Phase 3 Retarget
INFO: [Opt 31-1851] Number of loadless carry chains removed were: 0
INFO: [Opt 31-1834] Total Chains To Be Transformed Were: 0 AND Number of Transformed insts Created are: 0
INFO: [Opt 31-138] Pushed 0 inverter(s) to 0 load pin(s).
INFO: [Opt 31-49] Retargeted 0 cell(s).
Phase 3 Retarget | Checksum: 1f810878d

Time (s): cpu = 00:00:00.01 ; elapsed = 00:00:00.02 . Memory (MB): peak = 2647.609 ; gain = 0.000 ; free physical = 13693 ; free virtual = 36815
Retarget | Checksum: 1f810878d
INFO: [Opt 31-389] Phase Retarget created 0 cells and removed 0 cells

Phase 4 Constant propagation
INFO: [Opt 31-138] Pushed 0 inverter(s) to 0 load pin(s).
Phase 4 Constant propagation | Checksum: 1f810878d

Time (s): cpu = 00:00:00.01 ; elapsed = 00:00:00.02 . Memory (MB): peak = 2647.609 ; gain = 0.000 ; free physical = 13693 ; free virtual = 36815
Constant propagation | Checksum: 1f810878d
INFO: [Opt 31-389] Phase Constant propagation created 0 cells and removed 0 cells

Phase 5 Sweep
INFO: [Constraints 18-11670] Building netlist checker database with flags, 0x8
Done building netlist checker database: Time (s): cpu = 00:00:00 ; elapsed = 00:00:00 . Memory (MB): peak = 2647.609 ; gain = 0.000 ; free physical = 13693 ; free virtual = 36815
Phase 5 Sweep | Checksum: 1f810878d

Time (s): cpu = 00:00:00.01 ; elapsed = 00:00:00.02 . Memory (MB): peak = 2647.609 ; gain = 0.000 ; free physical = 13693 ; free virtual = 36815
Sweep | Checksum: 1f810878d
INFO: [Opt 31-389] Phase Sweep created 0 cells and removed 0 cells

Phase 6 BUFG optimization
Phase 6 BUFG optimization | Checksum: 1f810878d

Time (s): cpu = 00:00:00.01 ; elapsed = 00:00:00.02 . Memory (MB): peak = 2679.625 ; gain = 32.016 ; free physical = 13693 ; free virtual = 36815
BUFG optimization | Checksum: 1f810878d
INFO: [Opt 31-662] Phase BUFG optimization created 0 cells of which 0 are BUFGs and removed 0 cells.

Phase 7 Shift Register Optimization
INFO: [Opt 31-1064] SRL Remap converted 0 SRLs to 0 registers and converted 0 registers of register chains to 0 SRLs
Phase 7 Shift Register Optimization | Checksum: 1f810878d

Time (s): cpu = 00:00:00.01 ; elapsed = 00:00:00.02 . Memory (MB): peak = 2679.625 ; gain = 32.016 ; free physical = 13693 ; free virtual = 36815
Shift Register Optimization | Checksum: 1f810878d
INFO: [Opt 31-389] Phase Shift Register Optimization created 0 cells and removed 0 cells

Phase 8 Post Processing Netlist
Phase 8 Post Processing Netlist | Checksum: 1f810878d

Time (s): cpu = 00:00:00.01 ; elapsed = 00:00:00.02 . Memory (MB): peak = 2679.625 ; gain = 32.016 ; free physical = 13693 ; free virtual = 36815
Post Processing Netlist | Checksum: 1f810878d
INFO: [Opt 31-389] Phase Post Processing Netlist created 0 cells and removed 0 cells

Phase 9 Finalization

Phase 9.1 Finalizing Design Cores and Updating Shapes
Phase 9.1 Finalizing Design Cores and Updating Shapes | Checksum: 1f810878d

Time (s): cpu = 00:00:00.01 ; elapsed = 00:00:00.03 . Memory (MB): peak = 2679.625 ; gain = 32.016 ; free physical = 13693 ; free virtual = 36815

Phase 9.2 Verifying Netlist Connectivity

Starting Connectivity Check Task

Time (s): cpu = 00:00:00 ; elapsed = 00:00:00 . Memory (MB): peak = 2679.625 ; gain = 0.000 ; free physical = 13693 ; free virtual = 36815
Phase 9.2 Verifying Netlist Connectivity | Checksum: 1f810878d

Time (s): cpu = 00:00:00.01 ; elapsed = 00:00:00.03 . Memory (MB): peak = 2679.625 ; gain = 32.016 ; free physical = 13693 ; free virtual = 36815
Phase 9 Finalization | Checksum: 1f810878d

Time (s): cpu = 00:00:00.01 ; elapsed = 00:00:00.03 . Memory (MB): peak = 2679.625 ; gain = 32.016 ; free physical = 13693 ; free virtual = 36815
Opt_design Change Summary
=========================


-------------------------------------------------------------------------------------------------------------------------
|  Phase                        |  #Cells created  |  #Cells Removed  |  #Constrained objects preventing optimizations  |
-------------------------------------------------------------------------------------------------------------------------
|  Retarget                     |               0  |               0  |                                              0  |
|  Constant propagation         |               0  |               0  |                                              0  |
|  Sweep                        |               0  |               0  |                                              0  |
|  BUFG optimization            |               0  |               0  |                                              0  |
|  Shift Register Optimization  |               0  |               0  |                                              0  |
|  Post Processing Netlist      |               0  |               0  |                                              0  |
-------------------------------------------------------------------------------------------------------------------------


Ending Logic Optimization Task | Checksum: 1f810878d

Time (s): cpu = 00:00:00.01 ; elapsed = 00:00:00.03 . Memory (MB): peak = 2679.625 ; gain = 32.016 ; free physical = 13693 ; free virtual = 36815

Starting Power Optimization Task
INFO: [Pwropt 34-132] Skipping clock gating for clocks with a period < 2.00 ns.
Ending Power Optimization Task | Checksum: 1f810878d

Time (s): cpu = 00:00:00 ; elapsed = 00:00:00.01 . Memory (MB): peak = 2679.625 ; gain = 0.000 ; free physical = 13689 ; free virtual = 36810

Starting Final Cleanup Task
Ending Final Cleanup Task | Checksum: 1f810878d

Time (s): cpu = 00:00:00 ; elapsed = 00:00:00 . Memory (MB): peak = 2679.625 ; gain = 0.000 ; free physical = 13689 ; free virtual = 36810

Starting Netlist Obfuscation Task
Netlist sorting complete. Time (s): cpu = 00:00:00 ; elapsed = 00:00:00 . Memory (MB): peak = 2679.625 ; gain = 0.000 ; free physical = 13689 ; free virtual = 36810
Ending Netlist Obfuscation Task | Checksum: 1f810878d

Time (s): cpu = 00:00:00 ; elapsed = 00:00:00 . Memory (MB): peak = 2679.625 ; gain = 0.000 ; free physical = 13689 ; free virtual = 36811
INFO: [Common 17-83] Releasing license: Implementation
25 Infos, 56 Warnings, 56 Critical Warnings and 0 Errors encountered.
opt_design completed successfully
opt_design: Time (s): cpu = 00:00:07 ; elapsed = 00:00:06 . Memory (MB): peak = 2679.625 ; gain = 808.578 ; free physical = 13690 ; free virtual = 36812
INFO: [Vivado 12-24828] Executing command : report_drc -file ChipInterface_drc_opted.rpt -pb ChipInterface_drc_opted.pb -rpx ChipInterface_drc_opted.rpx
Command: report_drc -file ChipInterface_drc_opted.rpt -pb ChipInterface_drc_opted.pb -rpx ChipInterface_drc_opted.rpx
INFO: [IP_Flow 19-234] Refreshing IP repositories
INFO: [IP_Flow 19-1704] No user IP repositories specified
INFO: [IP_Flow 19-2313] Loaded Vivado IP repository '/afs/ece.cmu.edu/support/xilinx/xilinx.release/Vivado-2024.2/Vivado/2024.2/data/ip'.
INFO: [DRC 23-27] Running DRC with 8 threads
INFO: [Vivado_Tcl 2-168] The results of DRC are in file /afs/andrew.cmu.edu/usr21/eqian/private/18240/Lab1/project_1/project_1.runs/impl_1/ChipInterface_drc_opted.rpt.
report_drc completed successfully
Write ShapeDB Complete: Time (s): cpu = 00:00:00 ; elapsed = 00:00:00.01 . Memory (MB): peak = 2748.031 ; gain = 0.000 ; free physical = 13588 ; free virtual = 36710
INFO: [Timing 38-480] Writing timing data to binary archive.
Wrote PlaceDB: Time (s): cpu = 00:00:00 ; elapsed = 00:00:00 . Memory (MB): peak = 2748.031 ; gain = 0.000 ; free physical = 13591 ; free virtual = 36713
Wrote PulsedLatchDB: Time (s): cpu = 00:00:00 ; elapsed = 00:00:00 . Memory (MB): peak = 2748.031 ; gain = 0.000 ; free physical = 13587 ; free virtual = 36709
Writing XDEF routing.
Writing XDEF routing logical nets.
Writing XDEF routing special nets.
Wrote RouteStorage: Time (s): cpu = 00:00:00.01 ; elapsed = 00:00:00.01 . Memory (MB): peak = 2748.031 ; gain = 0.000 ; free physical = 13585 ; free virtual = 36706
Wrote Netlist Cache: Time (s): cpu = 00:00:00 ; elapsed = 00:00:00 . Memory (MB): peak = 2748.031 ; gain = 0.000 ; free physical = 13590 ; free virtual = 36711
Wrote Device Cache: Time (s): cpu = 00:00:00.01 ; elapsed = 00:00:00.01 . Memory (MB): peak = 2748.031 ; gain = 0.000 ; free physical = 13585 ; free virtual = 36708
Write Physdb Complete: Time (s): cpu = 00:00:00.07 ; elapsed = 00:00:00.08 . Memory (MB): peak = 2748.031 ; gain = 0.000 ; free physical = 13587 ; free virtual = 36709
INFO: [Common 17-1381] The checkpoint '/afs/andrew.cmu.edu/usr21/eqian/private/18240/Lab1/project_1/project_1.runs/impl_1/ChipInterface_opt.dcp' has been generated.
Command: place_design
Attempting to get a license for feature 'Implementation' and/or device 'xc7s50'
INFO: [Common 17-349] Got license for feature 'Implementation' and/or device 'xc7s50'
INFO: [Common 17-83] Releasing license: Implementation
INFO: [DRC 23-27] Running DRC with 8 threads
INFO: [Vivado_Tcl 4-198] DRC finished with 0 Errors
INFO: [Vivado_Tcl 4-199] Please refer to the DRC report (report_drc) for more information.
Running DRC as a precondition to command place_design
INFO: [DRC 23-27] Running DRC with 8 threads
INFO: [Vivado_Tcl 4-198] DRC finished with 0 Errors
INFO: [Vivado_Tcl 4-199] Please refer to the DRC report (report_drc) for more information.
INFO: [Place 30-611] Multithreading enabled for place_design using a maximum of 8 CPUs

Starting Placer Task

Phase 1 Placer Initialization

Phase 1.1 Placer Initialization Netlist Sorting
Netlist sorting complete. Time (s): cpu = 00:00:00 ; elapsed = 00:00:00 . Memory (MB): peak = 2801.590 ; gain = 0.000 ; free physical = 13536 ; free virtual = 36659
Phase 1.1 Placer Initialization Netlist Sorting | Checksum: 179081fc8

Time (s): cpu = 00:00:00 ; elapsed = 00:00:00.01 . Memory (MB): peak = 2801.590 ; gain = 0.000 ; free physical = 13539 ; free virtual = 36661
Netlist sorting complete. Time (s): cpu = 00:00:00 ; elapsed = 00:00:00 . Memory (MB): peak = 2801.590 ; gain = 0.000 ; free physical = 13539 ; free virtual = 36661

Phase 1.2 IO Placement/ Clock Placement/ Build Placer Device
INFO: [Timing 38-35] Done setting XDC timing constraints.
Phase 1.2 IO Placement/ Clock Placement/ Build Placer Device | Checksum: 179081fc8

Time (s): cpu = 00:00:00.15 ; elapsed = 00:00:00.05 . Memory (MB): peak = 2833.605 ; gain = 32.016 ; free physical = 13539 ; free virtual = 36661

Phase 1.3 Build Placer Netlist Model
Phase 1.3 Build Placer Netlist Model | Checksum: 266db0d36

Time (s): cpu = 00:00:00.23 ; elapsed = 00:00:00.06 . Memory (MB): peak = 2833.605 ; gain = 32.016 ; free physical = 13539 ; free virtual = 36661

Phase 1.4 Constrain Clocks/Macros
Phase 1.4 Constrain Clocks/Macros | Checksum: 266db0d36

Time (s): cpu = 00:00:00.23 ; elapsed = 00:00:00.06 . Memory (MB): peak = 2833.605 ; gain = 32.016 ; free physical = 13539 ; free virtual = 36661
Phase 1 Placer Initialization | Checksum: 266db0d36

Time (s): cpu = 00:00:00.23 ; elapsed = 00:00:00.06 . Memory (MB): peak = 2833.605 ; gain = 32.016 ; free physical = 13539 ; free virtual = 36661

Phase 2 Global Placement

Phase 2.1 Floorplanning
Phase 2.1 Floorplanning | Checksum: 266db0d36

Time (s): cpu = 00:00:00.23 ; elapsed = 00:00:00.07 . Memory (MB): peak = 2833.605 ; gain = 32.016 ; free physical = 13539 ; free virtual = 36661

Phase 2.2 Update Timing before SLR Path Opt
Phase 2.2 Update Timing before SLR Path Opt | Checksum: 266db0d36

Time (s): cpu = 00:00:00.24 ; elapsed = 00:00:00.07 . Memory (MB): peak = 2833.605 ; gain = 32.016 ; free physical = 13538 ; free virtual = 36660

Phase 2.3 Post-Processing in Floorplanning
Phase 2.3 Post-Processing in Floorplanning | Checksum: 266db0d36

Time (s): cpu = 00:00:00.24 ; elapsed = 00:00:00.07 . Memory (MB): peak = 2833.605 ; gain = 32.016 ; free physical = 13538 ; free virtual = 36660

Phase 2.4 Global Place Phase1
Phase 2.4 Global Place Phase1 | Checksum: 239d57746

Time (s): cpu = 00:00:00.41 ; elapsed = 00:00:00.12 . Memory (MB): peak = 2865.621 ; gain = 64.031 ; free physical = 13525 ; free virtual = 36647

Phase 2.5 Global Place Phase2
WARNING: [Place 46-29] Timing had been disabled during Placer and, therefore, physical synthesis in Placer will be skipped.
Phase 2.5 Global Place Phase2 | Checksum: 239d57746

Time (s): cpu = 00:00:00.54 ; elapsed = 00:00:00.14 . Memory (MB): peak = 2865.621 ; gain = 64.031 ; free physical = 13531 ; free virtual = 36653
Phase 2 Global Placement | Checksum: 239d57746

Time (s): cpu = 00:00:00.54 ; elapsed = 00:00:00.14 . Memory (MB): peak = 2865.621 ; gain = 64.031 ; free physical = 13531 ; free virtual = 36653

Phase 3 Detail Placement

Phase 3.1 Commit Multi Column Macros
Phase 3.1 Commit Multi Column Macros | Checksum: 239d57746

Time (s): cpu = 00:00:00.55 ; elapsed = 00:00:00.14 . Memory (MB): peak = 2865.621 ; gain = 64.031 ; free physical = 13531 ; free virtual = 36653

Phase 3.2 Commit Most Macros & LUTRAMs
Phase 3.2 Commit Most Macros & LUTRAMs | Checksum: 211156207

Time (s): cpu = 00:00:00.57 ; elapsed = 00:00:00.14 . Memory (MB): peak = 2865.621 ; gain = 64.031 ; free physical = 13531 ; free virtual = 36653

Phase 3.3 Area Swap Optimization
Phase 3.3 Area Swap Optimization | Checksum: 1fd43cf53

Time (s): cpu = 00:00:00.58 ; elapsed = 00:00:00.15 . Memory (MB): peak = 2865.621 ; gain = 64.031 ; free physical = 13531 ; free virtual = 36653

Phase 3.4 Pipeline Register Optimization
Phase 3.4 Pipeline Register Optimization | Checksum: 1fd43cf53

Time (s): cpu = 00:00:00.58 ; elapsed = 00:00:00.15 . Memory (MB): peak = 2865.621 ; gain = 64.031 ; free physical = 13531 ; free virtual = 36653

Phase 3.5 Small Shape Detail Placement
Phase 3.5 Small Shape Detail Placement | Checksum: 24dcb1270

Time (s): cpu = 00:00:00.97 ; elapsed = 00:00:00.3 . Memory (MB): peak = 2865.621 ; gain = 64.031 ; free physical = 13530 ; free virtual = 36652

Phase 3.6 Re-assign LUT pins
Phase 3.6 Re-assign LUT pins | Checksum: 24dcb1270

Time (s): cpu = 00:00:00.98 ; elapsed = 00:00:00.3 . Memory (MB): peak = 2865.621 ; gain = 64.031 ; free physical = 13530 ; free virtual = 36652

Phase 3.7 Pipeline Register Optimization
Phase 3.7 Pipeline Register Optimization | Checksum: 24dcb1270

Time (s): cpu = 00:00:01 ; elapsed = 00:00:00.3 . Memory (MB): peak = 2865.621 ; gain = 64.031 ; free physical = 13530 ; free virtual = 36652
Phase 3 Detail Placement | Checksum: 24dcb1270

Time (s): cpu = 00:00:01 ; elapsed = 00:00:00.3 . Memory (MB): peak = 2865.621 ; gain = 64.031 ; free physical = 13530 ; free virtual = 36652

Phase 4 Post Placement Optimization and Clean-Up

Phase 4.1 Post Commit Optimization
Phase 4.1 Post Commit Optimization | Checksum: 24dcb1270

Time (s): cpu = 00:00:01 ; elapsed = 00:00:00.33 . Memory (MB): peak = 2865.621 ; gain = 64.031 ; free physical = 13530 ; free virtual = 36652

Phase 4.2 Post Placement Cleanup
Phase 4.2 Post Placement Cleanup | Checksum: 24dcb1270

Time (s): cpu = 00:00:01 ; elapsed = 00:00:00.33 . Memory (MB): peak = 2865.621 ; gain = 64.031 ; free physical = 13530 ; free virtual = 36652

Phase 4.3 Placer Reporting

Phase 4.3.1 Print Estimated Congestion
INFO: [Place 30-612] Post-Placement Estimated Congestion 
 ____________________________________________________
|           | Global Congestion | Short Congestion  |
| Direction | Region Size       | Region Size       |
|___________|___________________|___________________|
|      North|                1x1|                1x1|
|___________|___________________|___________________|
|      South|                1x1|                1x1|
|___________|___________________|___________________|
|       East|                1x1|                1x1|
|___________|___________________|___________________|
|       West|                1x1|                1x1|
|___________|___________________|___________________|

Phase 4.3.1 Print Estimated Congestion | Checksum: 24dcb1270

Time (s): cpu = 00:00:01 ; elapsed = 00:00:00.33 . Memory (MB): peak = 2865.621 ; gain = 64.031 ; free physical = 13530 ; free virtual = 36652
Phase 4.3 Placer Reporting | Checksum: 24dcb1270

Time (s): cpu = 00:00:01 ; elapsed = 00:00:00.33 . Memory (MB): peak = 2865.621 ; gain = 64.031 ; free physical = 13530 ; free virtual = 36652

Phase 4.4 Final Placement Cleanup
Netlist sorting complete. Time (s): cpu = 00:00:00 ; elapsed = 00:00:00 . Memory (MB): peak = 2865.621 ; gain = 0.000 ; free physical = 13530 ; free virtual = 36652

Time (s): cpu = 00:00:01 ; elapsed = 00:00:00.33 . Memory (MB): peak = 2865.621 ; gain = 64.031 ; free physical = 13530 ; free virtual = 36652
Phase 4 Post Placement Optimization and Clean-Up | Checksum: 24dcb1270

Time (s): cpu = 00:00:01 ; elapsed = 00:00:00.33 . Memory (MB): peak = 2865.621 ; gain = 64.031 ; free physical = 13530 ; free virtual = 36652
Ending Placer Task | Checksum: 166fd572c

Time (s): cpu = 00:00:01 ; elapsed = 00:00:00.33 . Memory (MB): peak = 2865.621 ; gain = 64.031 ; free physical = 13530 ; free virtual = 36652
44 Infos, 57 Warnings, 56 Critical Warnings and 0 Errors encountered.
place_design completed successfully
INFO: [Vivado 12-24838] Running report commands "report_control_sets, report_io, report_utilization" in parallel.
Running report generation with 3 threads.
INFO: [Vivado 12-24828] Executing command : report_control_sets -verbose -file ChipInterface_control_sets_placed.rpt
report_control_sets: Time (s): cpu = 00:00:00.05 ; elapsed = 00:00:00.06 . Memory (MB): peak = 2865.621 ; gain = 0.000 ; free physical = 13522 ; free virtual = 36644
INFO: [Vivado 12-24828] Executing command : report_utilization -file ChipInterface_utilization_placed.rpt -pb ChipInterface_utilization_placed.pb
INFO: [Vivado 12-24828] Executing command : report_io -file ChipInterface_io_placed.rpt
report_io: Time (s): cpu = 00:00:00.09 ; elapsed = 00:00:00.12 . Memory (MB): peak = 2865.621 ; gain = 0.000 ; free physical = 13527 ; free virtual = 36649
Write ShapeDB Complete: Time (s): cpu = 00:00:00 ; elapsed = 00:00:00 . Memory (MB): peak = 2865.621 ; gain = 0.000 ; free physical = 13525 ; free virtual = 36647
INFO: [Timing 38-480] Writing timing data to binary archive.
Wrote PlaceDB: Time (s): cpu = 00:00:00 ; elapsed = 00:00:00 . Memory (MB): peak = 2865.621 ; gain = 0.000 ; free physical = 13526 ; free virtual = 36649
Wrote PulsedLatchDB: Time (s): cpu = 00:00:00 ; elapsed = 00:00:00 . Memory (MB): peak = 2865.621 ; gain = 0.000 ; free physical = 13522 ; free virtual = 36644
Writing XDEF routing.
Writing XDEF routing logical nets.
Writing XDEF routing special nets.
Wrote RouteStorage: Time (s): cpu = 00:00:00.01 ; elapsed = 00:00:00.01 . Memory (MB): peak = 2865.621 ; gain = 0.000 ; free physical = 13522 ; free virtual = 36644
Wrote Netlist Cache: Time (s): cpu = 00:00:00 ; elapsed = 00:00:00 . Memory (MB): peak = 2865.621 ; gain = 0.000 ; free physical = 13527 ; free virtual = 36649
Wrote Device Cache: Time (s): cpu = 00:00:00 ; elapsed = 00:00:00 . Memory (MB): peak = 2865.621 ; gain = 0.000 ; free physical = 13520 ; free virtual = 36643
Write Physdb Complete: Time (s): cpu = 00:00:00.06 ; elapsed = 00:00:00.08 . Memory (MB): peak = 2865.621 ; gain = 0.000 ; free physical = 13526 ; free virtual = 36649
INFO: [Common 17-1381] The checkpoint '/afs/andrew.cmu.edu/usr21/eqian/private/18240/Lab1/project_1/project_1.runs/impl_1/ChipInterface_placed.dcp' has been generated.
Command: phys_opt_design
Attempting to get a license for feature 'Implementation' and/or device 'xc7s50'
INFO: [Common 17-349] Got license for feature 'Implementation' and/or device 'xc7s50'

Starting Initial Update Timing Task

Time (s): cpu = 00:00:00 ; elapsed = 00:00:00.01 . Memory (MB): peak = 2865.621 ; gain = 0.000 ; free physical = 13528 ; free virtual = 36651
INFO: [Vivado_Tcl 4-235] No timing constraint found. The netlist was not modified.
INFO: [Common 17-83] Releasing license: Implementation
53 Infos, 57 Warnings, 56 Critical Warnings and 0 Errors encountered.
phys_opt_design completed successfully
Write ShapeDB Complete: Time (s): cpu = 00:00:00 ; elapsed = 00:00:00 . Memory (MB): peak = 2865.621 ; gain = 0.000 ; free physical = 13524 ; free virtual = 36647
INFO: [Timing 38-480] Writing timing data to binary archive.
Wrote PlaceDB: Time (s): cpu = 00:00:00 ; elapsed = 00:00:00 . Memory (MB): peak = 2865.621 ; gain = 0.000 ; free physical = 13527 ; free virtual = 36650
Wrote PulsedLatchDB: Time (s): cpu = 00:00:00 ; elapsed = 00:00:00 . Memory (MB): peak = 2865.621 ; gain = 0.000 ; free physical = 13523 ; free virtual = 36646
Writing XDEF routing.
Writing XDEF routing logical nets.
Writing XDEF routing special nets.
Wrote RouteStorage: Time (s): cpu = 00:00:00.02 ; elapsed = 00:00:00.01 . Memory (MB): peak = 2865.621 ; gain = 0.000 ; free physical = 13523 ; free virtual = 36646
Wrote Netlist Cache: Time (s): cpu = 00:00:00 ; elapsed = 00:00:00 . Memory (MB): peak = 2865.621 ; gain = 0.000 ; free physical = 13527 ; free virtual = 36650
Wrote Device Cache: Time (s): cpu = 00:00:00 ; elapsed = 00:00:00.01 . Memory (MB): peak = 2865.621 ; gain = 0.000 ; free physical = 13522 ; free virtual = 36645
Write Physdb Complete: Time (s): cpu = 00:00:00.07 ; elapsed = 00:00:00.08 . Memory (MB): peak = 2865.621 ; gain = 0.000 ; free physical = 13527 ; free virtual = 36650
INFO: [Common 17-1381] The checkpoint '/afs/andrew.cmu.edu/usr21/eqian/private/18240/Lab1/project_1/project_1.runs/impl_1/ChipInterface_physopt.dcp' has been generated.
Command: route_design
Attempting to get a license for feature 'Implementation' and/or device 'xc7s50'
INFO: [Common 17-349] Got license for feature 'Implementation' and/or device 'xc7s50'


Starting Routing Task
INFO: [Route 35-254] Multithreading enabled for route_design using a maximum of 8 CPUs

Phase 1 Build RT Design
Checksum: PlaceDB: c995f25 ConstDB: 0 ShapeSum: afd2c4d1 RouteDB: aa913336
Post Restoration Checksum: NetGraph: d3e5f64f | NumContArr: c17fb6a7 | Constraints: c2a8fa9d | Timing: c2a8fa9d
Phase 1 Build RT Design | Checksum: 31ab7a230

Time (s): cpu = 00:00:08 ; elapsed = 00:00:07 . Memory (MB): peak = 2897.570 ; gain = 31.949 ; free physical = 13464 ; free virtual = 36587

Phase 2 Router Initialization
INFO: [Route 35-64] No timing constraints were detected. The router will operate in resource-optimization mode.

Phase 2.1 Fix Topology Constraints
Phase 2.1 Fix Topology Constraints | Checksum: 31ab7a230

Time (s): cpu = 00:00:08 ; elapsed = 00:00:07 . Memory (MB): peak = 2928.570 ; gain = 62.949 ; free physical = 13433 ; free virtual = 36556

Phase 2.2 Pre Route Cleanup
Phase 2.2 Pre Route Cleanup | Checksum: 31ab7a230

Time (s): cpu = 00:00:08 ; elapsed = 00:00:07 . Memory (MB): peak = 2928.570 ; gain = 62.949 ; free physical = 13433 ; free virtual = 36556
 Number of Nodes with overlaps = 0

Router Utilization Summary
  Global Vertical Routing Utilization    = 0 %
  Global Horizontal Routing Utilization  = 0 %
  Routable Net Status*
  *Does not include unroutable nets such as driverless and loadless.
  Run report_route_status for detailed report.
  Number of Failed Nets               = 7
    (Failed Nets is the sum of unrouted and partially routed nets)
  Number of Unrouted Nets             = 7
  Number of Partially Routed Nets     = 0
  Number of Node Overlaps             = 0

Phase 2 Router Initialization | Checksum: 20e69cc97

Time (s): cpu = 00:00:08 ; elapsed = 00:00:07 . Memory (MB): peak = 2945.570 ; gain = 79.949 ; free physical = 13415 ; free virtual = 36538

Phase 3 Global Routing
Phase 3 Global Routing | Checksum: 20e69cc97

Time (s): cpu = 00:00:08 ; elapsed = 00:00:07 . Memory (MB): peak = 2945.570 ; gain = 79.949 ; free physical = 13415 ; free virtual = 36538

Phase 4 Initial Routing

Phase 4.1 Initial Net Routing Pass
Phase 4.1 Initial Net Routing Pass | Checksum: 290299177

Time (s): cpu = 00:00:08 ; elapsed = 00:00:07 . Memory (MB): peak = 2945.570 ; gain = 79.949 ; free physical = 13415 ; free virtual = 36538
Phase 4 Initial Routing | Checksum: 290299177

Time (s): cpu = 00:00:08 ; elapsed = 00:00:07 . Memory (MB): peak = 2945.570 ; gain = 79.949 ; free physical = 13415 ; free virtual = 36538

Phase 5 Rip-up And Reroute

Phase 5.1 Global Iteration 0
 Number of Nodes with overlaps = 0
Phase 5.1 Global Iteration 0 | Checksum: 2a9405cac

Time (s): cpu = 00:00:08 ; elapsed = 00:00:07 . Memory (MB): peak = 2945.570 ; gain = 79.949 ; free physical = 13415 ; free virtual = 36538
Phase 5 Rip-up And Reroute | Checksum: 2a9405cac

Time (s): cpu = 00:00:08 ; elapsed = 00:00:07 . Memory (MB): peak = 2945.570 ; gain = 79.949 ; free physical = 13415 ; free virtual = 36538

Phase 6 Delay and Skew Optimization
Phase 6 Delay and Skew Optimization | Checksum: 2a9405cac

Time (s): cpu = 00:00:08 ; elapsed = 00:00:07 . Memory (MB): peak = 2945.570 ; gain = 79.949 ; free physical = 13415 ; free virtual = 36538

Phase 7 Post Hold Fix

Phase 7.1 Hold Fix Iter
Phase 7.1 Hold Fix Iter | Checksum: 2a9405cac

Time (s): cpu = 00:00:08 ; elapsed = 00:00:07 . Memory (MB): peak = 2945.570 ; gain = 79.949 ; free physical = 13415 ; free virtual = 36538
Phase 7 Post Hold Fix | Checksum: 2a9405cac

Time (s): cpu = 00:00:08 ; elapsed = 00:00:07 . Memory (MB): peak = 2945.570 ; gain = 79.949 ; free physical = 13415 ; free virtual = 36538

Phase 8 Route finalize

Router Utilization Summary
  Global Vertical Routing Utilization    = 0.00884956 %
  Global Horizontal Routing Utilization  = 0.00221239 %
  Routable Net Status*
  *Does not include unroutable nets such as driverless and loadless.
  Run report_route_status for detailed report.
  Number of Failed Nets               = 0
    (Failed Nets is the sum of unrouted and partially routed nets)
  Number of Unrouted Nets             = 0
  Number of Partially Routed Nets     = 0
  Number of Node Overlaps             = 0


--GLOBAL Congestion:
Utilization threshold used for congestion level computation: 0.85
Congestion Report
North Dir 1x1 Area, Max Cong = 16.2162%, No Congested Regions.
South Dir 1x1 Area, Max Cong = 16.2162%, No Congested Regions.
East Dir 1x1 Area, Max Cong = 2.94118%, No Congested Regions.
West Dir 1x1 Area, Max Cong = 4.41176%, No Congested Regions.

------------------------------
Reporting congestion hotspots
------------------------------
Direction: North
----------------
Congested clusters found at Level 0
Effective congestion level: 0 Aspect Ratio: 1 Sparse Ratio: 0
Direction: South
----------------
Congested clusters found at Level 0
Effective congestion level: 0 Aspect Ratio: 1 Sparse Ratio: 0
Direction: East
----------------
Congested clusters found at Level 0
Effective congestion level: 0 Aspect Ratio: 1 Sparse Ratio: 0
Direction: West
----------------
Congested clusters found at Level 0
Effective congestion level: 0 Aspect Ratio: 1 Sparse Ratio: 0

Phase 8 Route finalize | Checksum: 2a9405cac

Time (s): cpu = 00:00:08 ; elapsed = 00:00:07 . Memory (MB): peak = 2945.570 ; gain = 79.949 ; free physical = 13415 ; free virtual = 36538

Phase 9 Verifying routed nets

 Verification completed successfully
Phase 9 Verifying routed nets | Checksum: 2a9405cac

Time (s): cpu = 00:00:08 ; elapsed = 00:00:07 . Memory (MB): peak = 2945.570 ; gain = 79.949 ; free physical = 13415 ; free virtual = 36538

Phase 10 Depositing Routes
Phase 10 Depositing Routes | Checksum: 2a9405cac

Time (s): cpu = 00:00:08 ; elapsed = 00:00:07 . Memory (MB): peak = 2945.570 ; gain = 79.949 ; free physical = 13415 ; free virtual = 36538

Phase 11 Post Process Routing
Phase 11 Post Process Routing | Checksum: 2a9405cac

Time (s): cpu = 00:00:08 ; elapsed = 00:00:07 . Memory (MB): peak = 2945.570 ; gain = 79.949 ; free physical = 13415 ; free virtual = 36538
Total Elapsed time in route_design: 7.19 secs

Phase 12 Post-Route Event Processing
Phase 12 Post-Route Event Processing | Checksum: f40e6854

Time (s): cpu = 00:00:08 ; elapsed = 00:00:07 . Memory (MB): peak = 2945.570 ; gain = 79.949 ; free physical = 13415 ; free virtual = 36538
INFO: [Route 35-16] Router Completed Successfully
Ending Routing Task | Checksum: f40e6854

Time (s): cpu = 00:00:08 ; elapsed = 00:00:07 . Memory (MB): peak = 2945.570 ; gain = 79.949 ; free physical = 13415 ; free virtual = 36538

Routing Is Done.
INFO: [Common 17-83] Releasing license: Implementation
60 Infos, 57 Warnings, 56 Critical Warnings and 0 Errors encountered.
route_design completed successfully
route_design: Time (s): cpu = 00:00:08 ; elapsed = 00:00:07 . Memory (MB): peak = 2945.570 ; gain = 79.949 ; free physical = 13415 ; free virtual = 36538
INFO: [Vivado 12-24828] Executing command : report_drc -file ChipInterface_drc_routed.rpt -pb ChipInterface_drc_routed.pb -rpx ChipInterface_drc_routed.rpx
Command: report_drc -file ChipInterface_drc_routed.rpt -pb ChipInterface_drc_routed.pb -rpx ChipInterface_drc_routed.rpx
INFO: [IP_Flow 19-1839] IP Catalog is up to date.
INFO: [DRC 23-27] Running DRC with 8 threads
INFO: [Vivado_Tcl 2-168] The results of DRC are in file /afs/andrew.cmu.edu/usr21/eqian/private/18240/Lab1/project_1/project_1.runs/impl_1/ChipInterface_drc_routed.rpt.
report_drc completed successfully
INFO: [Vivado 12-24828] Executing command : report_methodology -file ChipInterface_methodology_drc_routed.rpt -pb ChipInterface_methodology_drc_routed.pb -rpx ChipInterface_methodology_drc_routed.rpx
Command: report_methodology -file ChipInterface_methodology_drc_routed.rpt -pb ChipInterface_methodology_drc_routed.pb -rpx ChipInterface_methodology_drc_routed.rpx
INFO: [Timing 38-35] Done setting XDC timing constraints.
INFO: [DRC 23-133] Running Methodology with 8 threads
INFO: [Vivado_Tcl 2-1520] The results of Report Methodology are in file /afs/andrew.cmu.edu/usr21/eqian/private/18240/Lab1/project_1/project_1.runs/impl_1/ChipInterface_methodology_drc_routed.rpt.
report_methodology completed successfully
INFO: [Vivado 12-24828] Executing command : report_timing_summary -max_paths 10 -report_unconstrained -file ChipInterface_timing_summary_routed.rpt -pb ChipInterface_timing_summary_routed.pb -rpx ChipInterface_timing_summary_routed.rpx -warn_on_violation 
INFO: [Timing 38-35] Done setting XDC timing constraints.
INFO: [Timing 38-91] UpdateTimingParams: Speed grade: -1, Delay Type: min_max.
INFO: [Timing 38-191] Multithreading enabled for timing update using a maximum of 8 CPUs
WARNING: [Timing 38-313] There are no user specified timing constraints. Timing constraints are needed for proper timing analysis.
INFO: [Vivado 12-24838] Running report commands "report_bus_skew, report_incremental_reuse, report_route_status" in parallel.
Running report generation with 3 threads.
INFO: [Vivado 12-24828] Executing command : report_incremental_reuse -file ChipInterface_incremental_reuse_routed.rpt
INFO: [Vivado_Tcl 4-1062] Incremental flow is disabled. No incremental reuse Info to report.
INFO: [Vivado 12-24828] Executing command : report_route_status -file ChipInterface_route_status.rpt -pb ChipInterface_route_status.pb
INFO: [Vivado 12-24828] Executing command : report_bus_skew -warn_on_violation -file ChipInterface_bus_skew_routed.rpt -pb ChipInterface_bus_skew_routed.pb -rpx ChipInterface_bus_skew_routed.rpx
INFO: [Timing 38-91] UpdateTimingParams: Speed grade: -1, Delay Type: min_max.
INFO: [Timing 38-191] Multithreading enabled for timing update using a maximum of 8 CPUs
INFO: [Vivado 12-24828] Executing command : report_power -file ChipInterface_power_routed.rpt -pb ChipInterface_power_summary_routed.pb -rpx ChipInterface_power_routed.rpx
Command: report_power -file ChipInterface_power_routed.rpt -pb ChipInterface_power_summary_routed.pb -rpx ChipInterface_power_routed.rpx
WARNING: [Power 33-232] No user defined clocks were found in the design! Power estimation will be inaccurate until this is corrected.
Resolution: Please specify clocks using create_clock/create_generated_clock for sequential elements. For pure combinatorial circuits, please specify a virtual clock, otherwise the vectorless estimation might be inaccurate
Running Vector-less Activity Propagation...

Finished Running Vector-less Activity Propagation
80 Infos, 59 Warnings, 56 Critical Warnings and 0 Errors encountered.
report_power completed successfully
INFO: [Vivado 12-24828] Executing command : report_clock_utilization -file ChipInterface_clock_utilization_routed.rpt
Write ShapeDB Complete: Time (s): cpu = 00:00:00 ; elapsed = 00:00:00 . Memory (MB): peak = 3102.102 ; gain = 0.000 ; free physical = 13303 ; free virtual = 36426
INFO: [Timing 38-480] Writing timing data to binary archive.
Wrote PlaceDB: Time (s): cpu = 00:00:00 ; elapsed = 00:00:00 . Memory (MB): peak = 3102.102 ; gain = 0.000 ; free physical = 13305 ; free virtual = 36429
Wrote PulsedLatchDB: Time (s): cpu = 00:00:00 ; elapsed = 00:00:00 . Memory (MB): peak = 3102.102 ; gain = 0.000 ; free physical = 13300 ; free virtual = 36423
Writing XDEF routing.
Writing XDEF routing logical nets.
Writing XDEF routing special nets.
Wrote RouteStorage: Time (s): cpu = 00:00:00.01 ; elapsed = 00:00:00.01 . Memory (MB): peak = 3102.102 ; gain = 0.000 ; free physical = 13300 ; free virtual = 36424
Wrote Netlist Cache: Time (s): cpu = 00:00:00 ; elapsed = 00:00:00 . Memory (MB): peak = 3102.102 ; gain = 0.000 ; free physical = 13305 ; free virtual = 36428
Wrote Device Cache: Time (s): cpu = 00:00:00 ; elapsed = 00:00:00 . Memory (MB): peak = 3102.102 ; gain = 0.000 ; free physical = 13300 ; free virtual = 36424
Write Physdb Complete: Time (s): cpu = 00:00:00.06 ; elapsed = 00:00:00.08 . Memory (MB): peak = 3102.102 ; gain = 0.000 ; free physical = 13305 ; free virtual = 36429
INFO: [Common 17-1381] The checkpoint '/afs/andrew.cmu.edu/usr21/eqian/private/18240/Lab1/project_1/project_1.runs/impl_1/ChipInterface_routed.dcp' has been generated.
INFO: [Common 17-206] Exiting Vivado at Tue Feb  3 15:46:56 2026...

*** Running vivado
    with args -log ChipInterface.vdi -applog -m64 -product Vivado -messageDb vivado.pb -mode batch -source ChipInterface.tcl -notrace


****** Vivado v2024.2 (64-bit)
  **** SW Build 5239630 on Fri Nov 08 22:34:34 MST 2024
  **** IP Build 5239520 on Sun Nov 10 16:12:51 MST 2024
  **** SharedData Build 5239561 on Fri Nov 08 14:39:27 MST 2024
  **** Start of session at: Tue Feb  3 15:47:54 2026
    ** Copyright 1986-2022 Xilinx, Inc. All Rights Reserved.
    ** Copyright 2022-2024 Advanced Micro Devices, Inc. All Rights Reserved.

source ChipInterface.tcl -notrace
Command: open_checkpoint ChipInterface_routed.dcp
INFO: [Device 21-403] Loading part xc7s50csga324-1
Netlist sorting complete. Time (s): cpu = 00:00:00 ; elapsed = 00:00:00 . Memory (MB): peak = 1712.855 ; gain = 0.000 ; free physical = 14516 ; free virtual = 37640
INFO: [Project 1-479] Netlist was created with Vivado 2024.2
INFO: [Project 1-570] Preparing netlist for logic optimization
Read ShapeDB Complete: Time (s): cpu = 00:00:00 ; elapsed = 00:00:00 . Memory (MB): peak = 1770.730 ; gain = 0.000 ; free physical = 14444 ; free virtual = 37568
INFO: [Timing 38-478] Restoring timing data from binary archive.
INFO: [Timing 38-479] Binary timing data restore complete.
INFO: [Project 1-856] Restoring constraints from binary archive.
INFO: [Project 1-853] Binary constraint restore complete.
INFO: [Designutils 20-5722] Start Reading Physical Databases.
Reading placement.
Read Netlist Cache: Time (s): cpu = 00:00:00 ; elapsed = 00:00:00 . Memory (MB): peak = 2261.957 ; gain = 0.000 ; free physical = 14030 ; free virtual = 37154
Reading placer database...
Read Device Cache: Time (s): cpu = 00:00:00 ; elapsed = 00:00:00 . Memory (MB): peak = 2261.957 ; gain = 0.000 ; free physical = 14030 ; free virtual = 37154
Read PlaceDB: Time (s): cpu = 00:00:00 ; elapsed = 00:00:00 . Memory (MB): peak = 2261.957 ; gain = 0.000 ; free physical = 14030 ; free virtual = 37154
Read PulsedLatchDB: Time (s): cpu = 00:00:00 ; elapsed = 00:00:00 . Memory (MB): peak = 2261.957 ; gain = 0.000 ; free physical = 14030 ; free virtual = 37154
Reading routing.
Read RouteStorage: Time (s): cpu = 00:00:00.01 ; elapsed = 00:00:00 . Memory (MB): peak = 2261.957 ; gain = 0.000 ; free physical = 14030 ; free virtual = 37154
Read Physdb Files: Time (s): cpu = 00:00:00.01 ; elapsed = 00:00:00 . Memory (MB): peak = 2261.957 ; gain = 0.000 ; free physical = 14030 ; free virtual = 37154
Restored from archive | CPU: 0.030000 secs | Memory: 1.110893 MB |
Finished XDEF File Restore: Time (s): cpu = 00:00:00.03 ; elapsed = 00:00:00.03 . Memory (MB): peak = 2261.957 ; gain = 18.844 ; free physical = 14030 ; free virtual = 37154
Netlist sorting complete. Time (s): cpu = 00:00:00 ; elapsed = 00:00:00 . Memory (MB): peak = 2261.957 ; gain = 0.000 ; free physical = 14030 ; free virtual = 37154
INFO: [Project 1-111] Unisim Transformation Summary:
No Unisim elements were transformed.

INFO: [Project 1-604] Checkpoint was created with Vivado v2024.2 (64-bit) build 5239630
open_checkpoint: Time (s): cpu = 00:00:08 ; elapsed = 00:00:09 . Memory (MB): peak = 2261.957 ; gain = 766.176 ; free physical = 14028 ; free virtual = 37152
Command: write_bitstream -force ChipInterface.bit
Attempting to get a license for feature 'Implementation' and/or device 'xc7s50'
INFO: [Common 17-349] Got license for feature 'Implementation' and/or device 'xc7s50'
Running DRC as a precondition to command write_bitstream
INFO: [IP_Flow 19-234] Refreshing IP repositories
INFO: [IP_Flow 19-1704] No user IP repositories specified
INFO: [IP_Flow 19-2313] Loaded Vivado IP repository '/afs/ece.cmu.edu/support/xilinx/xilinx.release/Vivado-2024.2/Vivado/2024.2/data/ip'.
INFO: [DRC 23-27] Running DRC with 8 threads
INFO: [Vivado 12-3199] DRC finished with 0 Errors
INFO: [Vivado 12-3200] Please refer to the DRC report (report_drc) for more information.
INFO: [Designutils 20-2272] Running write_bitstream with 8 threads.
Loading data files...
Loading site data...
Loading route data...
Processing options...
Creating bitmap...
Creating bitstream...
Writing bitstream ./ChipInterface.bit...
INFO: [Vivado 12-1842] Bitgen Completed Successfully.
INFO: [Project 1-1876] WebTalk data collection is mandatory when using a ULT device. To see the specific WebTalk data collected for your design, open the usage_statistics_webtalk.html or usage_statistics_webtalk.xml file in the implementation directory.
INFO: [Common 17-83] Releasing license: Implementation
21 Infos, 0 Warnings, 0 Critical Warnings and 0 Errors encountered.
write_bitstream completed successfully
write_bitstream: Time (s): cpu = 00:00:07 ; elapsed = 00:00:15 . Memory (MB): peak = 2788.156 ; gain = 526.199 ; free physical = 13559 ; free virtual = 36691
INFO: [Common 17-206] Exiting Vivado at Tue Feb  3 15:48:20 2026...
